{
  "name": "steam",
  "label": "Steam",
  "aliases": ["steam"],
  "color": "#0B5A8E",
  "icon": "https://i.imgur.com/QbzZxrC.png",
  "providers": {
    "reddit": [
      {
        "subreddit": "Steam",
        "users": [
          {
            "name": "wickedplayer494",
            "titleFilter": "update"
          }
        ]
      }
    ],
    "rss": [
      {
        "label": "Steam Blog",
        "url": "https://steamcommunity.com/games/593110/rss/",
        "flavor": "steam"
      }
    ]
  }
}
