{
  "name": "ror2",
  "label": "Risk of Rain 2",
  "aliases": ["risk of rain 2", "risk of rain", "ror", "ror2", "ror 2"],
  "color": "#a9e4e9",
  "icon": "https://imgur.com/oQhrK1N.jpg",
  "providers": {
    "reddit": [
      {
        "subreddit": "ror2",
        "users": []
      }
    ],
    "steam": {
      "appID": 632360,
      "feeds": ["steam_community_announcements"]
    },
    "rss": []
  }
}
